{
  "id": "area_canal",
  "usage": "bg",
  "description": "Amsterdam canal fight stage — brick houses, water, boats, flag, cobbles.",
  "colors": [
    {"role": "sky0", "name": "sky_deep", "r": 10, "g": 18, "b": 28, "hex": "#5294E6"},
    {"role": "sky1", "name": "sky_lit", "r": 18, "g": 24, "b": 31, "hex": "#94C6FF"},
    {"role": "ramp_a0", "name": "brick_dark", "r": 12, "g": 5, "b": 4, "hex": "#632921"},
    {"role": "ramp_a1", "name": "brick_mid", "r": 20, "g": 9, "b": 6, "hex": "#A54A31"},
    {"role": "ramp_a2", "name": "brick_lit", "r": 26, "g": 14, "b": 9, "hex": "#D6734A"},
    {"role": "ramp_b0", "name": "water_dark", "r": 4, "g": 10, "b": 16, "hex": "#215284"},
    {"role": "ramp_b1", "name": "water_mid", "r": 6, "g": 16, "b": 22, "hex": "#3184B5"},
    {"role": "ramp_b2", "name": "water_lit", "r": 14, "g": 22, "b": 26, "hex": "#73B5D6"},
    {"role": "accent0", "name": "flag_red", "r": 26, "g": 4, "b": 4, "hex": "#D62121"},
    {"role": "accent1", "name": "flag_white", "r": 30, "g": 30, "b": 30, "hex": "#F7F7F7"},
    {"role": "accent2", "name": "flag_blue", "r": 4, "g": 8, "b": 22, "hex": "#2142B5"},
    {"role": "hot0", "name": "cobble_dark", "r": 8, "g": 8, "b": 8, "hex": "#424242"},
    {"role": "hot1", "name": "cobble_lit", "r": 16, "g": 15, "b": 14, "hex": "#847B73"},
    {"role": "emissive", "name": "window_glow", "r": 31, "g": 26, "b": 10, "hex": "#FFD652"},
    {"role": "skin_or_light", "name": "wood_boat", "r": 14, "g": 9, "b": 4, "hex": "#734A21"},
    {"role": "flash", "name": "canal_highlight", "r": 28, "g": 28, "b": 24, "hex": "#E6E6C6"}
  ]
}
