{
  "id": "char_trump",
  "usage": "obj",
  "description": "TRUMP — satirical SF boss; navy suit, red tie, orange-blond hair, tan skin.",
  "colors": [
    {"role": "transparent", "name": "trump_clear", "r": 0, "g": 0, "b": 0, "hex": "#000000"},
    {"role": "outline", "name": "trump_ink", "r": 3, "g": 2, "b": 3, "hex": "#181018"},
    {"role": "ramp_a0", "name": "suit_dark", "r": 4, "g": 6, "b": 12, "hex": "#213163"},
    {"role": "ramp_a1", "name": "suit_mid", "r": 6, "g": 10, "b": 18, "hex": "#315294"},
    {"role": "ramp_a2", "name": "suit_lit", "r": 10, "g": 14, "b": 22, "hex": "#5273B5"},
    {"role": "ramp_b0", "name": "hair_dark", "r": 20, "g": 12, "b": 4, "hex": "#A56321"},
    {"role": "ramp_b1", "name": "hair_mid", "r": 28, "g": 18, "b": 6, "hex": "#E69431"},
    {"role": "ramp_b2", "name": "hair_lit", "r": 31, "g": 24, "b": 10, "hex": "#FFC652"},
    {"role": "accent0", "name": "tie_red_dark", "r": 16, "g": 2, "b": 2, "hex": "#841010"},
    {"role": "accent1", "name": "tie_red", "r": 28, "g": 4, "b": 4, "hex": "#E62121"},
    {"role": "accent2", "name": "shirt_white", "r": 30, "g": 30, "b": 30, "hex": "#F7F7F7"},
    {"role": "hot0", "name": "shoe_black", "r": 2, "g": 2, "b": 2, "hex": "#101010"},
    {"role": "hot1", "name": "flag_pin", "r": 4, "g": 8, "b": 22, "hex": "#2142B5"},
    {"role": "emissive", "name": "tan_lit", "r": 31, "g": 22, "b": 14, "hex": "#FFB573"},
    {"role": "skin_or_light", "name": "tan_skin", "r": 28, "g": 18, "b": 12, "hex": "#E69463"},
    {"role": "flash", "name": "trump_flash", "r": 31, "g": 31, "b": 28, "hex": "#FFFFE6"}
  ]
}
